smartctl 7.4 2023-08-01 r5530 [armv7l-linux-6.6.142] (localbuild)
Copyright (C) 2002-23, Bruce Allen, Christian Franke, www.smartmontools.org

=== START OF INFORMATION SECTION ===
Device Model:     KINGSTON SKC600MS512G
Serial Number:    50026B7TEST2
LU WWN Device Id: 5 0026b7 28287test
Firmware Version: S4500109
User Capacity:    512,110,190,592 bytes [512 GB]
Sector Sizes:     512 bytes logical, 4096 bytes physical
Rotation Rate:    Solid State Device
Form Factor:      2.5 inches
TRIM Command:     Available, deterministic, zeroed
Device is:        Not in smartctl database
ATA Version is:   ACS-3 T13/2161-D revision 5
SATA Version is:  SATA 3.3, 6.0 Gb/s (current: 6.0 Gb/s)
Local Time is:    Fri Jul 10 23:46:28 2026 CEST
SMART support is: Available - device has SMART capability.
SMART support is: Enabled

=== START OF READ SMART DATA SECTION ===
SMART overall-health self-assessment test result: PASSED

SMART Attributes Data Structure revision number: 16
Vendor Specific SMART Attributes with Thresholds:
ID# ATTRIBUTE_NAME          FLAG     VALUE WORST THRESH TYPE      UPDATED  WHEN_FAILED RAW_VALUE
  1 Raw_Read_Error_Rate     0x0000   100   100   000    Old_age   Offline      -       0
  5 Reallocated_Sector_Ct   0x0000   100   100   000    Old_age   Offline      -       0
  9 Power_On_Hours          0x0000   100   100   000    Old_age   Offline      -       1754
 12 Power_Cycle_Count       0x0000   100   100   000    Old_age   Offline      -       39
148 Unknown_Attribute       0x0000   100   100   000    Old_age   Offline      -       307
149 Unknown_Attribute       0x0000   100   100   000    Old_age   Offline      -       30
150 Unknown_Attribute       0x0000   100   100   000    Old_age   Offline      -       5
151 Unknown_Attribute       0x0000   100   100   000    Old_age   Offline      -       23
159 Unknown_Attribute       0x0000   100   100   000    Old_age   Offline      -       0
160 Unknown_Attribute       0x0000   100   100   000    Old_age   Offline      -       0
161 Unknown_Attribute       0x0000   100   100   000    Old_age   Offline      -       18
164 Unknown_Attribute       0x0000   100   100   000    Old_age   Offline      -       4349
165 Unknown_Attribute       0x0000   100   100   000    Old_age   Offline      -       55
166 Unknown_Attribute       0x0000   100   100   000    Old_age   Offline      -       3
167 Unknown_Attribute       0x0000   100   100   000    Old_age   Offline      -       20
169 Unknown_Attribute       0x0000   099   099   000    Old_age   Offline      -       99
177 Wear_Leveling_Count     0x0000   100   100   050    Old_age   Offline      -       0
181 Program_Fail_Cnt_Total  0x0000   100   100   000    Old_age   Offline      -       0
182 Erase_Fail_Count_Total  0x0000   100   100   000    Old_age   Offline      -       0
192 Power-Off_Retract_Count 0x0000   100   100   000    Old_age   Offline      -       17
194 Temperature_Celsius     0x0000   041   053   000    Old_age   Offline      -       41
195 Hardware_ECC_Recovered  0x0000   100   100   000    Old_age   Offline      -       0
196 Reallocated_Event_Count 0x0000   100   100   016    Old_age   Offline      -       0
199 UDMA_CRC_Error_Count    0x0000   100   100   050    Old_age   Offline      -       0
231 Unknown_SSD_Attribute   0x0000   099   099   000    Old_age   Offline      -       99
232 Available_Reservd_Space 0x0000   100   100   000    Old_age   Offline      -       100
241 Total_LBAs_Written      0x0000   100   100   000    Old_age   Offline      -       81572
242 Total_LBAs_Read         0x0000   100   100   000    Old_age   Offline      -       38109
245 Unknown_Attribute       0x0000   100   100   000    Old_age   Offline      -       352269

SMART Error Log Version: 1
No Errors Logged

SMART Self-test log structure revision number 1
No self-tests have been logged.  [To run self-tests, use: smartctl -t]

The above only provides legacy SMART information - try 'smartctl -x' for more
