smartctl 7.4 2023-08-01 r5530 [x86_64-linux-6.8.0-generic] (local build)
Copyright (C) 2002-23, Bruce Allen, Christian Franke, www.smartmontools.org

=== START OF INFORMATION SECTION ===
Model Family:     Samsung based SSDs
Device Model:     Samsung SSD 860 EVO 1TB
Serial Number:    S3Z8TEST
LU WWN Device Id: 5 002538 e40a1b2c3
Firmware Version: RVT04B6Q
User Capacity:    1,000,204,886,016 bytes [1.00 TB]
Sector Size:      512 bytes logical/physical
Rotation Rate:    Solid State Device
Form Factor:      2.5 inches
Device is:        In smartctl database 7.3/5528
ATA Version is:   ACS-4 T13/BSR INCITS 529 revision 5
SATA Version is:  SATA 3.2, 6.0 Gb/s (current: 6.0 Gb/s)
Local Time is:    Mon Jul  6 12:00:00 2026 UTC
SMART support is: Available - device has SMART capability.
SMART support is: Enabled
Power mode is:    ACTIVE or IDLE

=== START OF READ SMART DATA SECTION ===
SMART overall-health self-assessment test result: PASSED

SMART Attributes Data Structure revision number: 1
Vendor Specific SMART Attributes with Thresholds:
ID# ATTRIBUTE_NAME          FLAG     VALUE WORST THRESH TYPE      UPDATED  WHEN_FAILED RAW_VALUE
  5 Reallocated_Sector_Ct   0x0033   100   100   010    Pre-fail  Always       -       0
  9 Power_On_Hours          0x0032   096   096   000    Old_age   Always       -       17520
 12 Power_Cycle_Count       0x0032   099   099   000    Old_age   Always       -       123
177 Wear_Leveling_Count     0x0013   091   091   000    Pre-fail  Always       -       154
190 Airflow_Temperature_Cel 0x0032   069   049   000    Old_age   Always       -       31
195 ECC_Error_Rate          0x001a   200   200   000    Old_age   Always       -       0
199 CRC_Error_Count         0x003e   100   100   000    Old_age   Always       -       0
235 POR_Recovery_Count      0x0012   099   099   000    Old_age   Always       -       21
241 Total_LBAs_Written      0x0032   099   099   000    Old_age   Always       -       48839342917
