smartctl 7.4 2023-08-01 r5530 [x86_64-linux-6.8.0-generic] (local build)
Copyright (C) 2002-23, Bruce Allen, Christian Franke, www.smartmontools.org

=== START OF INFORMATION SECTION ===
Model Family:     Seagate BarraCuda 3.5 (SMR)
Device Model:     ST4000DM004-2CV104
Serial Number:    ZFN1TEST
LU WWN Device Id: 5 000c50 0a1b2c3d4
Firmware Version: 0001
User Capacity:    4,000,787,030,016 bytes [4.00 TB]
Sector Sizes:     512 bytes logical, 4096 bytes physical
Rotation Rate:    5425 rpm
Form Factor:      3.5 inches
Device is:        In smartctl database 7.3/5528
ATA Version is:   ACS-3 T13/2161-D revision 5
SATA Version is:  SATA 3.1, 6.0 Gb/s (current: 6.0 Gb/s)
Local Time is:    Mon Jul  6 12:00:00 2026 UTC
SMART support is: Available - device has SMART capability.
SMART support is: Enabled
Power mode is:    ACTIVE or IDLE

=== START OF READ SMART DATA SECTION ===
SMART overall-health self-assessment test result: PASSED

SMART Attributes Data Structure revision number: 10
Vendor Specific SMART Attributes with Thresholds:
ID# ATTRIBUTE_NAME          FLAG     VALUE WORST THRESH TYPE      UPDATED  WHEN_FAILED RAW_VALUE
  1 Raw_Read_Error_Rate     0x000f   083   064   006    Pre-fail  Always       -       217704217
  3 Spin_Up_Time            0x0003   096   096   000    Pre-fail  Always       -       0
  4 Start_Stop_Count        0x0032   100   100   020    Old_age   Always       -       95
  5 Reallocated_Sector_Ct   0x0033   100   100   010    Pre-fail  Always       -       0
  7 Seek_Error_Rate         0x000f   087   060   045    Pre-fail  Always       -       471458910
  9 Power_On_Hours          0x0032   077   077   000    Old_age   Always       -       20573
 12 Power_Cycle_Count       0x0032   100   100   020    Old_age   Always       -       94
190 Airflow_Temperature_Cel 0x0022   061   050   045    Old_age   Always       -       39 (Min/Max 24/44)
194 Temperature_Celsius     0x0022   038   050   000    Old_age   Always       -       38 (0 24 0 0 0)
197 Current_Pending_Sector  0x0012   100   100   000    Old_age   Always       -       8
198 Offline_Uncorrectable   0x0010   100   100   000    Old_age   Offline      -       0
199 UDMA_CRC_Error_Count    0x003e   200   200   000    Old_age   Always       -       3
