smartctl 7.4 2023-08-01 r5530 [FreeBSD 14.1-RELEASE amd64] (local build)
Copyright (C) 2002-23, Bruce Allen, Christian Franke, www.smartmontools.org

=== START OF INFORMATION SECTION ===
Model Number:                       Samsung SSD 980 PRO 1TB
Serial Number:                      S5GXTEST
Firmware Version:                   5B2QGXA7
PCI Vendor/Subsystem ID:            0x144d
IEEE OUI Identifier:                0x002538
Total NVM Capacity:                 1,000,204,886,016 [1.00 TB]
Unallocated NVM Capacity:           0
Controller ID:                      6
NVMe Version:                       1.3
Number of Namespaces:               1
Namespace 1 Size/Capacity:          1,000,204,886,016 [1.00 TB]
Namespace 1 Utilization:            532,676,608,000 [532 GB]
Namespace 1 Formatted LBA Size:     512
Local Time is:                      Mon Jul  6 12:00:00 2026 UTC

=== START OF SMART DATA SECTION ===
SMART overall-health self-assessment test result: PASSED

SMART/Health Information (NVMe Log 0x02)
Critical Warning:                   0x00
Temperature:                        41 Celsius
Available Spare:                    100%
Available Spare Threshold:          10%
Percentage Used:                    3%
Data Units Read:                    47,675,124 [24.4 TB]
Data Units Written:                 33,101,281 [16.9 TB]
Host Read Commands:                 561,238,357
Host Write Commands:                791,528,963
Controller Busy Time:               1,234
Power Cycles:                       1,024
Power On Hours:                     8,760
Unsafe Shutdowns:                   42
Media and Data Integrity Errors:    0
Error Information Log Entries:      0
Warning  Comp. Temperature Time:    0
Critical Comp. Temperature Time:    0
Temperature Sensor 1:               41 Celsius
Temperature Sensor 2:               45 Celsius
